{
  "module_id": "test.test_module",
  "version": "0.1.0",
  "category": "test",
  "capability_type": "validator",
  "path": "C:/SkynetFactory/production-modules/test.test_module",
  "contract_path": "C:/SkynetFactory/production-modules/test.test_module/module.contract.json",
  "sidecar_path": "C:/SkynetFactory/production-modules/test.test_module/module.sidecar.json",
  "status": "deprecated",
  "contract_hash": "abc123",
  "created_at": "2026-05-07T00:05:01.691Z",
  "updated_at": "2026-05-07T00:05:01.693Z",
  "tags": [
    "test"
  ],
  "acceptance_evidence_path": ""
}